analyses/paper_validation/2008_held/tables/table_001/table_001.csv

Parameter,Unit,Abbreviation,Value
Segment number,-,"$m_{\text {seg }, 1}$",1.204659
Segment diameter,Å,$\sigma_{1}$,2.792700
,Å,"$T_{\text {dep, } 1}$",10.1100
,1/K,"$T_{\text {dep }, 2}$",-0.01775
,Å,"$T_{\text {dep, } 3}$",-1.41700
,1/K,"$T_{\text {dep }, 4}$",-0.01146
Dispersion energy,K,$u_{1} / k_{\mathrm{B}}$,353.9449
Association sites,-,$\mathrm{N}_{1}$,2
Association energy,K,$\varepsilon_{\mathrm{hb}}^{\mathrm{A} 1 \mathrm{~B} 1} / \mathrm{k}_{\mathrm{B}}$,2425.6714
Association volume,-,$\kappa_{\mathrm{hb}}^{\mathrm{A} 1 \mathrm{~B} 1}$,0.0450989

docs/papers/md/MEA/Predicting vapor−liquid equilibria for sour-gas absorption in aqueous mixtures of chemical and physical solvents or ionic liquids with EPC-SAFT.md

## THEORY

${ }^{a} N^{\text {assoc }}$ gives the number of associating sites. ${ }^{b} \sigma=2.7927+(10.11 \cdot \mathrm{e}^{-0.01775 \mathrm{~T}}-1.417 \cdot \mathrm{e}^{-0.01146 \mathrm{~T}}$ ).